{
  "schema_version": 1,
  "generator": "homepage-django convert_notebook_md_to_json",
  "source_commit": "f5b2e9f2a6066efd2aec9810da0910433fd58fbd",
  "built_at": "2026-06-10T07:03:10+00:00",
  "title": "Sample Notebook with Jupytext Integration",
  "author": [
    "Rico A.R. Picone"
  ],
  "description": "A sample notebook demonstrating jupytext Python code integration with markdown.",
  "acronym": "",
  "cover_image": "",
  "pdf_file": "",
  "chapters": [
    {
      "title": "Introduction",
      "slug": "introduction",
      "sections": [
        {
          "title": "Overview",
          "slug": "overview",
          "html": "<h1 id=\"overview\">Overview</h1>\n<p>Welcome to this sample notebook demonstrating the integration of jupytext Python code with markdown documentation. This notebook showcases how to seamlessly combine version-controlled Python code with narrative text for creating publishable technical documentation.</p>\n<h2 id=\"what-is-jupytext-integration\">What is Jupytext Integration?</h2>\n<p>Jupytext integration allows you to:</p>\n<ul>\n<li>Write Python code in <code>.py</code> files using jupytext's percent (<code># %%</code>) or light format</li>\n<li>Keep these files under version control alongside your markdown content</li>\n<li>Automatically convert them to markdown during the build process</li>\n<li>Include the converted code in your notebook sections using simple syntax</li>\n</ul>\n<h2 id=\"benefits-of-this-approach\">Benefits of This Approach</h2>\n<h3 id=\"version-control-friendly\">Version Control Friendly</h3>\n<ul>\n<li>Python code is stored in <code>.py</code> files, making git diffs clean and meaningful</li>\n<li>No more dealing with JSON-heavy notebook files in version control</li>\n<li>Easy to review code changes and collaborate with others</li>\n</ul>\n<h3 id=\"best-of-both-worlds\">Best of Both Worlds</h3>\n<ul>\n<li>Write code in your favorite Python IDE with full syntax highlighting and debugging</li>\n<li>Maintain the narrative structure and publishability of Jupyter notebooks</li>\n<li>Generate beautiful HTML output suitable for web publishing</li>\n</ul>\n<h3 id=\"reproducible-research\">Reproducible Research</h3>\n<ul>\n<li>Code and documentation stay synchronized</li>\n<li>Easy to run, test, and validate all code examples</li>\n<li>Facilitates reproducible research workflows</li>\n</ul>\n<h2 id=\"how-it-works\">How It Works</h2>\n<p>The system works through several integrated components:</p>\n<ol type=\"1\">\n<li><strong>Python Source Files</strong>: Write your code in <code>.py</code> files using jupytext formats</li>\n<li><strong>Automatic Conversion</strong>: The build system detects and converts jupytext files to markdown</li>\n<li><strong>Pandoc Integration</strong>: A custom filter handles include directives in your markdown</li>\n<li><strong>Seamless Publishing</strong>: The final notebook includes both narrative and executable code</li>\n</ol>\n<h2 id=\"include-syntax\">Include Syntax</h2>\n<p>To include a jupytext Python file in your markdown, use:</p>\n<div class=\"sourceCode\" id=\"cb1\" data-lang=\"markdown\"><pre class=\"sourceCode markdown language-markdown\"><code class=\"sourceCode markdown\"><span id=\"cb1-1\"><a href=\"#cb1-1\" aria-hidden=\"true\" tabindex=\"-1\"></a><span class=\"in\">```{.include-py path=&quot;relative/path/to/your_code.py&quot;}</span></span></code></pre></div>\n<p>The system will: - Look for the corresponding <code>.md</code> file (auto-generated from your <code>.py</code> file) - Include the converted markdown content in your section - Fall back to showing the raw Python code if conversion fails</p>\n<h2 id=\"supported-formats\">Supported Formats</h2>\n<h3 id=\"percent-format\">Percent Format</h3>\n<p>Uses <code># %%</code> to delimit cells, similar to VS Code and Spyder:</p>\n<div class=\"sourceCode\" id=\"cb2\" data-lang=\"python\"><pre class=\"sourceCode python language-python\"><code class=\"sourceCode python\"><span id=\"cb2-1\"><a href=\"#cb2-1\" aria-hidden=\"true\" tabindex=\"-1\"></a><span class=\"co\"># %% [markdown]</span></span>\n<span id=\"cb2-2\"><a href=\"#cb2-2\" aria-hidden=\"true\" tabindex=\"-1\"></a><span class=\"co\"># This is a markdown cell</span></span>\n<span id=\"cb2-3\"><a href=\"#cb2-3\" aria-hidden=\"true\" tabindex=\"-1\"></a></span>\n<span id=\"cb2-4\"><a href=\"#cb2-4\" aria-hidden=\"true\" tabindex=\"-1\"></a><span class=\"co\"># %%</span></span>\n<span id=\"cb2-5\"><a href=\"#cb2-5\" aria-hidden=\"true\" tabindex=\"-1\"></a><span class=\"co\"># This is a code cell</span></span>\n<span id=\"cb2-6\"><a href=\"#cb2-6\" aria-hidden=\"true\" tabindex=\"-1\"></a><span class=\"bu\">print</span>(<span class=\"st\">&quot;Hello, world!&quot;</span>)</span></code></pre></div>\n<h3 id=\"light-format\">Light Format</h3>\n<p>Uses simple comments for markdown and explicit markers for complex cells:</p>\n<div class=\"sourceCode\" id=\"cb3\" data-lang=\"python\"><pre class=\"sourceCode python language-python\"><code class=\"sourceCode python\"><span id=\"cb3-1\"><a href=\"#cb3-1\" aria-hidden=\"true\" tabindex=\"-1\"></a><span class=\"co\"># This is a markdown cell</span></span>\n<span id=\"cb3-2\"><a href=\"#cb3-2\" aria-hidden=\"true\" tabindex=\"-1\"></a><span class=\"co\"># with multiple lines</span></span>\n<span id=\"cb3-3\"><a href=\"#cb3-3\" aria-hidden=\"true\" tabindex=\"-1\"></a></span>\n<span id=\"cb3-4\"><a href=\"#cb3-4\" aria-hidden=\"true\" tabindex=\"-1\"></a><span class=\"co\"># This is also markdown</span></span>\n<span id=\"cb3-5\"><a href=\"#cb3-5\" aria-hidden=\"true\" tabindex=\"-1\"></a></span>\n<span id=\"cb3-6\"><a href=\"#cb3-6\" aria-hidden=\"true\" tabindex=\"-1\"></a><span class=\"co\"># A code cell starts here</span></span>\n<span id=\"cb3-7\"><a href=\"#cb3-7\" aria-hidden=\"true\" tabindex=\"-1\"></a><span class=\"bu\">print</span>(<span class=\"st\">&quot;Hello, world!&quot;</span>)</span>\n<span id=\"cb3-8\"><a href=\"#cb3-8\" aria-hidden=\"true\" tabindex=\"-1\"></a></span>\n<span id=\"cb3-9\"><a href=\"#cb3-9\" aria-hidden=\"true\" tabindex=\"-1\"></a><span class=\"co\"># + </span></span>\n<span id=\"cb3-10\"><a href=\"#cb3-10\" aria-hidden=\"true\" tabindex=\"-1\"></a><span class=\"co\"># An explicit code cell</span></span>\n<span id=\"cb3-11\"><a href=\"#cb3-11\" aria-hidden=\"true\" tabindex=\"-1\"></a>complex_code <span class=\"op\">=</span> <span class=\"va\">True</span></span>\n<span id=\"cb3-12\"><a href=\"#cb3-12\" aria-hidden=\"true\" tabindex=\"-1\"></a><span class=\"co\"># -</span></span></code></pre></div>\n<h2 id=\"next-steps\">Next Steps</h2>\n<p>In the following chapters, you'll see practical examples of:</p>\n<ul>\n<li>Data analysis workflows with pandas and numpy</li>\n<li>Advanced plotting techniques with matplotlib and plotly</li>\n<li>Mathematical modeling and simulation</li>\n<li>Statistical analysis and visualization</li>\n</ul>\n<p>Each example demonstrates both the technical implementation and the integration approach, showing how to maintain clean, version-controlled code while producing publication-ready documentation.</p>\n",
          "anchors": []
        },
        {
          "title": "Getting Started",
          "slug": "getting-started",